buildingId,propertyId,preferredName,imagePath,sourceUrl,sourceLabel,sourcePageTitle,sourceLang,description,aliases
costar_668362,668362,Frost Bank Tower,/building-photos/frost-bank-tower.jpg,https://en.wikipedia.org/wiki/Frost_Bank_Tower,Curated Wikipedia registry,Frost Bank Tower,en,"The Frost Bank Tower is a 33-story Austin office skyscraper at 401 Congress Avenue and remains one of the city's signature downtown towers.",Frost Bank Tower
costar_10574917,10574917,Indeed Tower,/building-photos/indeed-tower.png,https://en.wikipedia.org/wiki/Indeed_Tower,Curated Wikipedia registry,Indeed Tower,en,"Indeed Tower is a downtown Austin office skyscraper at 200 West 6th Street and is one of the tallest office towers in the market.",Indeed Tower
costar_591286,591286,One American Center,/building-photos/one-american-center.jpg,https://en.wikipedia.org/wiki/One_American_Center,Curated Wikipedia registry,One American Center,en,"One American Center, also recognized in the CRM by its 600 Congress address, is a prominent downtown Austin office tower at the northwest corner of 6th and Congress.",One American Center|600 Congress|600 Congress Ave
costar_591333,591333,San Jacinto Center,/building-photos/san-jacinto-center.jpg,https://en.wikipedia.org/wiki/San_Jacinto_Center,Curated Wikipedia registry,San Jacinto Center,en,"San Jacinto Center is a three-building downtown Austin office complex overlooking Lady Bird Lake and anchored by its 21-story office tower.",San Jacinto Center
costar_591425,591425,100 Congress,/building-photos/100-congress.jpg,https://fr.wikipedia.org/wiki/100_Congress,Curated Wikipedia registry,100 Congress,fr,"100 Congress is a downtown Austin office tower in the Congress Avenue corridor and remains one of the core Class A buildings in the CBD skyline.",100 Congress
costar_609207,609207,3600B San Clemente,/building-photos/3600b-san-clemente.jpg,https://content.hpitx.com/hubfs/Austin%20Leasing%20Flyers/Office/3600B%20San%20Clemente%20-%20Flyer.pdf,Curated HPI flyer registry,3600B San Clemente,en,"3600B San Clemente is a three-story Southwest Austin office property at 3600 North Capital of Texas Highway with HPI leasing and property management coverage.",3600B San Clemente|3600 San Clemente Building B|3600 N Capital of Texas Hwy
